19,20,zomato,NA,"['Zomato is an online restaurant guide and food ordering platform that allows users to order meals from restaurants and have them delivered.', 'trusted recommendations. Zomato connects over 55 million users to restaurants in 24 countries. It is backed by investors such as Tiger Global, Temasek, Baillie Gifford, Kora, Luxor, Fidelity (FMR), D1 Capital, Baillie Gifford, Mirae, Steadview, and Ant Financial.']","Gurgaon, Haryana, India",10001+,"['Food Delivery', 'Mobile Apps', 'Reservations', 'Restaurants']",Private,www.zomato.com,['2008'],['Asia-Pacific (APAC)'],"['Deepinder Goyal, Gaurav Gupta, Pankaj Chaddah']",['Active'],NA,['Venture - Series Unknown'],['For Profit'],NA,NA,24,20,$2.1B,1,12,14,20,NA,NA,NA,NA,NA,NA,NA,NA,NA,3,NA,1,NA,NA,NA,NA,NA,NA,NA,NA
20,21,citigroup,NA,"['Citigroup is a diversified financial services holding company that provides various financial products and services.', 'Citigroup is a diversified financial services holding company that provides various financial products and services.\nThe company operates through two segments, Global Consumer Banking (GCB) and Institutional Clients Group (ICG). The GCB segment offers traditional banking services to retail customers through retail banking, commercial banking,', 'Citi-branded cards, and Citi retail services. The ICG segment offers various banking, and financial products and services to corporate, institutional, public sector, and high-net-worth clients. This segment provides wholesale banking products and services, including fixed income and equity sales and trading, foreign exchange, prime brokerage, derivative services, equity and fixed income research, corporate lending, investment banking and advisory services, private banking, cash management, trade finance, and securities services.\nCitigroup Inc. was founded in 1812 and is based in New York, United States.']","New York, New York, United States",10001+,"['Banking', 'Credit Cards', 'Financial Services', 'Wealth Management']",NA,www.citigroup.com,"['Oct 8, 1998']","['Greater New York Area, East Coast, Northeastern US']",NA,['Active'],NA,['Post-IPO Equity'],['For Profit'],NA,NA,2,2,NA,21,2,6,NA,NA,NA,NA,NA,NA,NA,NA,NA,2,91,5,21,NA,['NYSE:C'],NA,NA,NA,NA,NA,NA
21,22,twilio,NA,"['Twilio is a cloud communication company that enables users to use standard web languages to build voice, VoIP, and SMS apps via a web API.', 'Twilio, the developer platform for communications is reinventing telecom by merging the worlds of cloud computing, web services, and telecommunications. With Twilio, developers and businesses make communications more contextual by embedding voice, video, messaging, and authentication directly into applications.\nIt was founded in 2008 and is based', 'in San Francisco, California.']","San Francisco, California, United States",1001-5000,"['Enterprise Software', 'Messaging', 'Mobile Apps', 'SMS', 'VoIP']",Public,www.twilio.com,"['Jun 30, 2008']","['San Francisco Bay Area, West Coast, Western US']","['Evan Cooke, Jeff Lawson, John Wolthuis']",['Active'],NA,['Undisclosed'],['For Profit'],NA,NA,NA,10,$236.2M,2,NA,8,152,NA,NA,NA,NA,NA,NA,NA,NA,NA,8,NA,2,NA,NA,NA,NA,NA,NA,NA,NA
22,23,sap,NA,"['SAP is a technology company that develops enterprise application software for companies and industries across diverse sectors.', 'SAP is a technology company that develops enterprise application software for companies and industries across diverse sectors.\nThe company offers solutions covering various lines of businesses, including asset management, commerce, finance, human resources, manufacturing, marketing, sales, services, sourcing and procurement, supply chain, and', 'sustainability as well as research and development, and engineering. It provides enterprise application software to various industries, including consumer, discrete manufacturing, public services, energy and natural resources, financial services, and many other services.\nIn addition, the company offers SAP HANA, a platform that combines database, data processing, and application platform capabilities as well as simplifies application development and processing across big data sources and structures; and SAP HANA Cloud Platform which enables ease and flexibility in building, extending, and integrating business applications available to its partners, customers, and third-party developers. It also provides SAP Business Suite and SAP Business Warehouse as well as custom SAP HANA applications in the company’s cloud data centers.\nAdditionally, the company provides analytic solutions such as enterprise business intelligence, agile visualization, and advanced analytics for information and data needs. It also offers design, rapid deployment, and custom development; support services, software updates, and enhancements; and consulting and training services.\nSAP was founded in 1972 and is headquartered in Walldorf, Germany.']","Walldorf, Baden-Wurttemberg, Germany",10001+,"['Business Intelligence', 'Computer', 'Finance', 'Software']",Public,www.sap.com/,"['Apr 1, 1972']",['European Union (EU)'],"['Andreas Neumeier, Claus Wellenreuther, Dietmar Hopp, Hans-Werner Hector, Hasso Plattner, Klaus Tschira']",['Active'],NA,['Post-IPO Equity'],['For Profit'],NA,NA,NA,2,$1.3B,13,NA,48,504,NA,NA,NA,NA,NA,NA,NA,NA,NA,27,NA,13,NA,NA,NA,NA,NA,NA,NA,NA
23,24,flutterwave,NA,"['Flutterwave provides a payment service for global merchants and payment service providers.', 'Flutterwave provides a payment service for global merchants and payment service providers.\nIt provides technology, infrastructure, and services to enable global merchants, payment service providers, and helps banks and businesses build secure and seamless payment solutions for their customers by smoothening the exchange of funds.\nThe company was', 'founded in 2016 by Iyinoluwa Aboyeji and Olugbenga Agboola and is headquartered in San Francisco, California.']","San Francisco, California, United States",11-50,"['Developer APIs', 'FinTech', 'Payments', 'Software']",Private,www.flutterwave.com,['2016'],"['San Francisco Bay Area, West Coast, Western US']","['Iyinoluwa Aboyeji, Olugbenga Agboola']",['Active'],NA,['Secondary Market'],['For Profit'],NA,NA,32,NA,$64.7M,NA,NA,NA,6,NA,29,NA,95,"503,602",7.77%,NA,NA,NA,NA,NA,NA,NA,NA,NA,NA,NA,NA,NA,NA
24,25,drift,NA,"['Use conversations to make business buying frictionless, more enjoyable, and more human.', 'conversation with a business at any time, on their terms.']","Boston, Massachusetts, United States",251-500,"['Apps', 'Enterprise Software', 'Internet', 'Marketing Automation', 'Sales Automation', 'Software']",Private,www.drift.com,['2015'],"['Greater Boston Area, East Coast, New England']","['David Cancel, Elias Torres']",['Active'],NA,['Series C'],['For Profit'],NA,NA,12,3,$107M,NA,3,3,14,NA,NA,NA,NA,NA,NA,NA,NA,NA,NA,NA,NA,NA,NA,NA,NA,NA,NA,NA,NA
25,26,solo-funds-inc,NA,"['SoLo is a marketplace community allowing members to easily access and supply short-term funds for immediate needs.', 'heights, but grounded in the same hope and mission: to build a community that enables financial autonomy for all.']","Los Angeles, California, United States",11-50,"['Financial Services', 'FinTech', 'Lending', 'Peer to Peer']",Private,www.solofunds.com,"['Mar 17, 2016']","['Greater Los Angeles Area, West Coast, Western US']","['Jarrel Carter, Rodney Williams, Taylor Bruno, Travis Holoway']",['Active'],NA,['Series A'],['For Profit'],NA,NA,18,NA,$12.8M,NA,NA,NA,4,NA,20,NA,36,"7,392",-2.92%,NA,NA,NA,NA,NA,NA,NA,NA,NA,NA,NA,NA,NA,NA
26,27,crowdstrike,NA,"['CrowdStrike is a cybersecurity technology firm pioneering cloud delivered next-generation endpoint protection and services.', 'cost and complexity for customers.\nCrowdStrike’s Falcon platform is delivered via the security industry’s only 100% native cloud architecture, integrated with 24/7 managed hunting capabilities and in-house threat intelligence and incident response teams. CrowdStrike’s unique Threat Graph harnesses the cloud to instantly analyze data from billions of endpoint events across a global crowdsourcing community, allowing detection and prevention of attacks based on patented behavioral pattern recognition technology.']","Sunnyvale, California, United States",501-1000,"['Crowdsourcing', 'Cyber Security', 'Network Security', 'SaaS']",Public,www.crowdstrike.com,['2011'],"['San Francisco Bay Area, Silicon Valley, West Coast']","['Dmitri Alperovitch, George Kurtz, Gregg Marston']",['Active'],NA,['Series E'],['For Profit'],NA,NA,11,7,$481M,NA,4,3,44,NA,NA,NA,NA,NA,NA,NA,NA,NA,3,NA,NA,NA,NA,NA,NA,NA,NA,NA,NA
27,28,unacademy,NA,"['Unacademy is an online learning platform that provides educational content such as video lectures and examinations.', 'Unacademy is a learning platform that provides content for major competitive examinations as well as offers short lectures in the form of videos on different subjects which can be accessed for free. It allows aspiring students to better prepare for their competitive examinations and promote self-learning.\nUnacademy was originally created in 2010', 'via YouTube channel and was officially launched in 2015. The company is based in Bangalore, India.']","Bangalore, Karnataka, India",251-500,"['E-Learning', 'EdTech', 'Education', 'Training']",Private,unacademy.com/,['2015'],['Asia-Pacific (APAC)'],"['Gaurav Munjal, Hemesh Singh, Roman Saini, Sachin Gupta']",['Active'],NA,['Venture - Series Unknown'],['For Profit'],NA,NA,36,NA,$398.5M,NA,NA,8,4,NA,NA,NA,NA,NA,NA,NA,NA,NA,NA,NA,NA,NA,NA,NA,NA,NA,NA,NA,NA
28,29,facebook,NA,"['Facebook is an online social networking service that enables its users to connect with friends and family.', 'Facebook is an online social networking service that allows its users to connect with friends and family as well as make new connections.\nIt provides its users with the ability to create a profile, update information, add images, send friend requests, and accept requests from other users. Its features include status update, photo tagging and', 'sharing, and more. Facebook’s profile structure includes a timeline, information related to the user, images of the user, images added by friends of the user, notes, pages, groups, and more. It enables its users to create pages related to entertainment, sports, business, finance, preferences, hobbies, culture, religion, causes, organizations, and a number of other categories. It also enables its users to join or create groups related to a vast number of categories.\nWith millions of more users, [Friendster] attempted to acquire the company for $10 million in mid-2004. Facebook turned down the offer and subsequently received $12.7 million in funding from [Accel Partners] at a valuation of around $100 million. Facebook continued to grow opening up to high school students in September 2005 and adding a photo-sharing feature the next month. The next spring, Facebook received $25 million in funding from [Greylock Partners] and [Meritech Capital] as well as previous investors [Accel Partners] and [Peter Thiel]. The pre-money valuation for this deal was about $525 million. Facebook subsequently opened up to work networks eventually amassing over 20,000 work networks. Finally, in September 2006, Facebook was opened to anyone with an email address.\nFacebook continued to receive funding most notably in January 2011 receiving $1.5 billion and valuing the company at $50 billion. A year later in February 2012, Facebook announced that it was filing for its long-anticipated initial public offering. The company went public on May 18, 2012 opening in [NASDAQ] with shares trading at $42.05.\nFacebook announced positive numbers in February 2012 upon filing for its IPO. As of July 2013 over 1.15 billion users have logged into Facebook every month and 669 million users daily. Mobile users now make up half of Facebook’s user base with 819 million monthly actives. Facebook is one of the most trafficked sites in the United States. Additionally, Facebook is the top photo-sharing site with 250 million photos uploaded per day.\nThe company has a strategic partnership with AXA Group to develop marketing and commercial collaboration in the digital, social, and mobile sphere.\nFacebook is currently the owner of many applications and services such as Pagemodo Pagebuilder, [RSS Graffiti], Huddle, and more. It is the world’s largest social network with over 1.32 billion monthly active users.\nFacebook was founded by Mark Zuckerberg in Menlo Park, California in 2004.']","Menlo Park, California, United States",10001+,"['Mobile Apps', 'Social', 'Social Media', 'Social Network']",Public,www.facebook.com,"['Feb 4, 2004']","['San Francisco Bay Area, Silicon Valley, West Coast']","['Andrew McCollum, Chris Hughes, Dustin Moskovitz, Eduardo Saverin, Mark Zuckerberg, Nicholas Daniel-Richards, Rob Jagnow']",['Active'],NA,['Post-IPO Equity'],['For Profit'],NA,NA,26,17,$16.1B,NA,11,89,876,NA,NA,NA,NA,NA,NA,NA,NA,NA,35,NA,NA,NA,NA,NA,NA,NA,NA,NA,NA
29,30,bitwise-industries,NA,"['Bitwise is a tech ecosystem that provides access to resources for those in marginalized communities.', 'custom software development firm, Shift3 Technologies. And, the ever-growing place component is made up of Bitwise’s collaborative workplace, Hashtag, the technology hub, Bitwise South Stadium, and two new projects currently under construction in downtown Fresno, Bitwise|41 and Bitwise State Center Warehouse.']","Fresno, California, United States",101-250,"['Coworking', 'Education', 'Human Resources', 'Software', 'Training']",Private,bitwiseindustries.com/,"['Jul 1, 2013']","['West Coast, Western US']","['Irma Olguin, Jake Soberal']",['Active'],NA,['Series B'],['For Profit'],NA,NA,16,NA,$77M,NA,NA,NA,2,NA,NA,NA,NA,NA,NA,NA,NA,NA,NA,NA,NA,NA,NA,NA,NA,NA,NA,NA,NA
30,31,auth0,NA,"['Auth0 is an identity management platform for web, mobile, IoT, and internal applications.', 'AAuth0 is an identity management platform for application builders and developers. It provides Auth0, a web-scale cloud solution that includes APIs and tools that enable developers to eliminate the friction of authentication and authorization of their applications and APIs.\nAuth0 enables users to single sign-on for applications running on various', ""platforms with various identity providers; add few lines of JavaScript to power their applications; customize various stages of the authentication and authorization pipeline, and connect their applications and APIs to their database of users and passwords. Its platform also allows users to authenticate to active directory, LDAP, SAML, Integrated Windows Authentication, Google Apps, Salesforce, and other IdPs without having to configure firewall; add and remove users, modify profiles and authorization attributes, and identify root cause user login issues; see a stream of recent logins and their locations; and enable various SaaS and SAML-enabled applications.\nAuth0's solution works with iOS, Android, and Windows Phone 8 platforms. Its platform is used by large and small enterprises, and startups.""]","Bellevue, Washington, United States",501-1000,"['Developer APIs', 'Enterprise Software', 'Identity Management', 'Information Technology']",Private,auth0.com/,"['Feb 1, 2013']","['Greater Seattle Area, West Coast, Western US']","['Eugenio Pace, Matias Woloski']",['Active'],NA,['Series F'],['For Profit'],NA,NA,15,NA,$332.3M,NA,NA,1,27,NA,NA,NA,NA,NA,NA,NA,NA,NA,NA,NA,NA,NA,NA,NA,NA,NA,NA,NA,NA
31,32,deliveroo,NA,"['Deliveroo owns and operates an online food delivery platform in the United Kingdom.', 'Deliveroo owns and operates an online food delivery platform in the United Kingdom. Its platform allows users to order food from local restaurants. Gregory Orlowski and William Shu founded Deliveroo in 2012. It has its headquarters in London in the United Kingdom.']","London, England, United Kingdom",1001-5000,"['Delivery', 'Food and Beverage', 'Food Delivery', 'Restaurants', 'Same Day Delivery']",Private,deliveroo.co.uk/,['2012'],NA,"['Greg Orlowski, William Shu']",['Active'],NA,['Series H'],['For Profit'],NA,NA,28,NA,$1.7B,NA,NA,2,27,NA,NA,NA,NA,NA,NA,NA,NA,NA,NA,NA,NA,NA,NA,NA,NA,NA,NA,NA,NA
32,33,okta,NA,"['Okta is a management platform that secures critical resources from cloud to ground for workforce and customers.', 'device. Thousands of customers, including Experian, 20th Century Fox, LinkedIn, Flex, News Corp, Dish Networks, and Adobe trust Okta to work faster, boost revenue, and stay secure.\nOkta helps customers fulfill their missions faster by making it safe and easy to use the technologies they need to do their most significant work.']","San Francisco, California, United States",1001-5000,"['CRM', 'Enterprise Software', 'Identity Management', 'Management Information Systems']",Public,www.okta.com,"['Jan 1, 2009']","['San Francisco Bay Area, West Coast, Western US']","['Frederic Kerrest, Todd McKinnon']",['Active'],NA,['Secondary Market'],['For Profit'],NA,NA,16,8,$229.3M,NA,3,5,60,NA,NA,NA,NA,NA,NA,NA,NA,NA,NA,NA,NA,NA,NA,NA,NA,NA,NA,NA,NA
33,34,roku,NA,"['Roku pioneers streaming for the TV and aspires to power every TV in the world.', 'by our growing, passionate and highly engaged customer base who love Roku streaming devices because of our coveted content selection, ease of use, and value.']","Los Gatos, California, United States",1001-5000,"['Advertising Platforms', 'Consumer Electronics', 'Digital Entertainment', 'Hardware']",Public,www.roku.com/,"['Oct 1, 2002']","['San Francisco Bay Area, Silicon Valley, West Coast']",['Anthony Wood'],['Active'],NA,['Series H'],['For Profit'],NA,NA,14,11,$208.6M,NA,5,4,24,NA,49,NA,82,"24,947,811",-7.26%,NA,NA,NA,NA,NA,NA,NA,NA,NA,NA,NA,NA,NA,NA
34,35,nearpod,NA,"['Nearpod is a provider of edtech platform for K-12 teachers to create interactive slides filled with videos, quizzes, and other activities.', 'Nearpod is an all-in-one solution for the synchronized use of iPads in the classroom that makes lectures more engaging through interactive multimedia presentations. With Nearpod, teachers can create mobile presentations, engage students in class, and assess them in real time.\nThe fast adoption of tablet computing and mobile devices is having a', 'profound impact on education. Nearpod allows educators to very easily take their existing presentations, convert them into mobile-friendly content, and engage all students to convert them into active classroom participants. Teachers can deliver their existing content through mobile (iOS or Android) devices and get instant feedback from students through interactive features like polls, quizzes, drawing activities, and others.']","Dania, Florida, United States",251-500,"['E-Learning', 'EdTech', 'Education', 'Mobile Apps', 'Skill Assessment', 'Virtual Reality']",Private,www.nearpod.com,['2012'],"['Greater Miami Area, East Coast, Southern US']","['Emiliano Abramzon, Felipe Sommer, Guido Kovalskys']",['Active'],NA,['Series B'],['For Profit'],NA,NA,20,NA,$30.7M,NA,NA,1,12,NA,NA,NA,NA,NA,NA,NA,NA,NA,NA,NA,NA,NA,NA,NA,NA,NA,NA,NA,NA
35,36,epic-games-2,NA,"['Epic Games is an American video game and software company that creates games and offers its game engine technology to other developers.', 'interactive experiences for PC, console, mobile, and virtual reality devices.\nIt was founded in 1991 and is headquartered in Cary, North Carolina.']","Cary, North Carolina, United States",1001-5000,"['Developer Platform', 'Gaming', 'Software', 'Video Games']",Private,www.epicgames.com,['1991'],"['Research Triangle, East Coast, Southern US']",['Mark Rein'],['Active'],NA,['Venture - Series Unknown'],['For Profit'],NA,NA,22,6,$3.4B,NA,4,13,31,NA,NA,NA,NA,NA,NA,NA,NA,NA,8,NA,NA,NA,NA,NA,NA,NA,NA,NA,NA
36,37,promise,NA,"['PromisePay provides a modern payment processing platform built for utilities and government agencies.', 'payment plans. PromisePay has a team working 24/7 to talk to residents and help them make their payments. This means residents pay off debt faster, the government gets more revenue, and government works better for everyone.\nPromise is a financial services technology company. PromisePay builds payment processing tools and services for the government. Promise has a team of technology and government experts from companies like Palantir, Stripe, and Google, and has raised over $11M from investors like First Round, 8VC, Roc Nation, Jay Z, and Y Combinator.']","Oakland, California, United States",11-50,"['Debt Collections', 'Financial Services', 'FinTech', 'Government', 'Mobile Payments']",NA,joinpromise.com/,['2017'],"['San Francisco Bay Area, West Coast, Western US']","['Diana Frappier, Phaedra Ellis-Lamkins']",['Active'],NA,['Series A'],['For Profit'],NA,NA,NA,NA,$23.1M,NA,NA,NA,NA,NA,NA,NA,NA,NA,NA,NA,NA,NA,NA,NA,NA,NA,NA,NA,NA,NA,NA,NA,NA
37,38,peloton-interactive,NA,"['Peloton is an interactive fitness platform reinventing fitness with live and on-demand boutique studio classes.', 'comprehensive and socially connected experience that makes every workout both efficient and addicting. By merging hardware, software, and content, the company creates the most unique, efficient, and addicting workout experience on the market. Peloton is sold online and in its growing number of showrooms across the country.\nThe company was founded in 2012 and is headquartered in New York.']","New York, New York, United States",1001-5000,"['Cycling', 'Fitness', 'Wellness']",Public,www.onepeloton.com,['2012'],"['Greater New York Area, East Coast, Northeastern US']","['Graham Stanton, John Foley, Tom Cortese, Yony Feng']",['Active'],NA,['Post-IPO Debt'],['For Profit'],NA,NA,20,9,$1.9B,NA,7,4,51,NA,NA,NA,NA,NA,NA,NA,NA,NA,1,NA,NA,NA,NA,NA,NA,NA,NA,NA,NA
38,39,kraken,NA,"['Kraken is a cryptocurrency exchange that provides spot and futures trading between Bitcoin, Ethereum and 40+ other digital assets.', 'playing an important role in the mainstream adoption of crypto assets.Kraken is a marketplace for digital assets where buyers, sellers, traders and speculators come together to exchange cryptocurrencies like Bitcoin, Ethereum, Litecoin and Ripple against national currencies like USD, EUR, CAD and JPY. Clients trading larger sizes benefit from our principal Over-the-Counter (OTC) desk and white glove service. Advanced traders and technical analysis wizards can take advantage of our professional charting tools. Software engineers, botters and hobbyist automators have available both REST and Websocket APIs with which trades can be made and market information obtained. Kraken provides 24/7 live chat support for any questions you have about getting started.']","San Francisco, California, United States",1001-5000,"['Asset Management', 'Bitcoin', 'Blockchain', 'Ethereum', 'Financial Exchanges', 'Financial Services', 'FinTech', 'Personal Finance', 'Stock Exchanges', 'Trading Platform']",NA,www.kraken.com/,"['Jul 28, 2011']","['San Francisco Bay Area, West Coast, Western US']",['Jesse Powell'],['Active'],NA,['Secondary Market'],['For Profit'],NA,NA,NA,NA,$118.5M,NA,NA,10,NA,NA,19,NA,NA,"16,091,549",70.65%,NA,NA,NA,2,NA,NA,NA,NA,NA,NA,NA,NA,NA,NA
39,40,twitch,NA,"['Twitch is social video platform for gamers where more than 100 million gather every month to broadcast, watch and talk about video games.', 'outlets, events, user generated content, and the entire esports scene. In February 2014, Wall Street Journal ranked Twitch as the 4th largest website in terms of peak internet traffic in the U.S. fortifying the brand as an entertainment industry leader and the epicenter of social video for gamers.']","San Francisco, California, United States",251-500,"['Social Media', 'Video', 'Video Games', 'Video Streaming']",Private,www.twitch.tv/,['2007'],"['San Francisco Bay Area, West Coast, Western US']","['Emmett Shear, Justin Kan, Kevin Lin, Kyle Vogt, Michael Seibel, Omar Javed']",['Active'],NA,['Series C'],['For Profit'],NA,NA,9,3,$35M,NA,2,6,56,NA,49,NA,6,"924,395,874",8.26%,NA,NA,NA,NA,NA,NA,NA,NA,NA,NA,NA,NA,NA,NA
40,41,uipath,NA,"['UiPath is a software company developing robotic process automation and artificial intelligence software.', 'UiPath designs and develops robotic process automation software. The platform offers foolproof development tools, automation of intricate processes, enhanced control, cloud and on-premise deployment, robust governance, and multiple robots on a single virtual machine. UiPath was founded in 2005 and headquartered in New York, United States.']","New York, New York, United States",1001-5000,"['Artificial Intelligence', 'Enterprise Software', 'Information Technology', 'Machine Learning']",Private,www.uipath.com,['2005'],"['Greater New York Area, East Coast, Northeastern US']","['Daniel Dines, Marius Tirca']",['Active'],NA,['Series F'],['For Profit'],NA,NA,27,NA,$2B,NA,NA,2,42,NA,NA,NA,NA,NA,NA,NA,NA,NA,NA,NA,NA,NA,NA,NA,NA,NA,NA,NA,NA
