41,42,skydio,NA,"['Skydio uses artificial intelligence to create flying drones that are used by consumer, enterprise, and government customers.', ""Skydio is a drone manufacturer that uses artificial intelligence to create flying drones that are used by consumers, enterprises, and government customers.\nIt develops AI-powered drones to deliver the power and flying cameras without the complexity. The company's drones use an array of cameras and proprietary computer vision technology to"", ""recognize, avoid objects in real-time, and predict into the future to make intelligent decisions, enabling users by flying themselves through the most demanding tasks or keeping them safe from obstacles when they want to take control. The company's debut drone, the R1, could track a target and film them while avoiding obstacles without any human intervention required. Then the company released the Skydio 2 in 2019, its second drone, cutting off more than half the price while improving it its autonomous tracking and video capabilities. Its flagship product, the X2, is equipped with seven cameras, 100x zoom, night vision, and promises to turn ordinary users into expert pilots thanks to its self-piloting abilities. It is backed by top investors and strategic partners including Andreessen Horowitz, Linse Capital, Next47, IVP, Playground, NVIDIA, and UP.Partners.\nAbraham Bachrach, Adam Bry, and Matt Donahoe founded Klarna in Redwood City, California in 2014.""]","Redwood City, California, United States",101-250,"['Artificial Intelligence', 'Drone Management', 'Drones', 'Robotics', 'Software']",Private,www.skydio.com,['2014'],"['San Francisco Bay Area, Silicon Valley, West Coast']","['Abraham Bachrach, Adam Bry, Matt Donahoe']",['Active'],NA,['Series D'],['For Profit'],NA,NA,15,NA,$340M,NA,NA,NA,17,NA,NA,NA,NA,NA,NA,NA,NA,NA,NA,NA,NA,NA,NA,NA,NA,NA,NA,NA,NA
42,43,shopify,NA,"['Shopify is a cloud-based, multi-channel commerce platform designed for small and medium-sized businesses.', 'a powerful back-office and a single view of their business.\nShopify offers online retailers a suite of services including marketing, customer engagement, payments, and shipping tools to simplify the process of running an online store for small merchants. They launched an application programming interface (API) platform and App Store that allows developers to create applications for Shopify online stores and then sell them on the Shopify App Store.\nThe Shopify platform was engineered for reliability and scale, making enterprise-level technology available to businesses of all sizes. Shopify currently powers over 800,000 businesses in approximately 175 countries and is trusted by brands such as Tesla, Red Bull, Nestle, GE, Kylie Cosmetics, and many more.\nShopify was founded in 2004 and is headquartered in Ottawa, Ontario, Canada.']","Ottawa, Ontario, Canada",1001-5000,"['E-Commerce', 'E-Commerce Platforms', 'Enterprise Software', 'SaaS']",Public,www.shopify.com,"['Jun 2, 2004']",['Great Lakes'],"['Daniel Weinand, Scott Lake, Tobias Lütke']",['Active'],NA,['Series C'],['For Profit'],NA,NA,8,4,$122.3M,NA,5,11,95,NA,79,"4,123,202",143,"128,179,990",1.1%,NA,NA,NA,NA,NA,NA,NA,NA,NA,NA,NA,NA,NA,NA
43,44,sitecore,NA,"['Sitecore is a customer experience management company that provides multichannel marketing automation software and web content management.', ""minute interaction – and intention – that customers and prospects have with a brand, both on a website and across other digital channels.\nSitecore creates human connections between brands and their customers with rich end-to-end content, seamless commerce, and always-on personalization so brands can thrive in a world where, without a digital experience, there is no product. The company's Experience Cloud empowers marketers to deliver personalized content in realtime and at scale across every channel—before, during, and after a sale.\nSitecore has 3,500+ customers worldwide, including leading global brands including American Express, Carnival Cruise Lines, easyJet, Heineken, and Microsoft, as well as governments, associations, and public institutions. There are approximately 8,000 certified Sitecore developers and 23,000 active members in Sitecore’s developer network.\nSitecore has been positioned by Gartner, Inc. in the Leaders Quadrant of the Magic Quadrant for Web Content Management (WCM) for four consecutive years. Sitecore has also been positioned by Gartner in the Visionaries Quadrant of the 2013 & 2012 Magic Quadrant for Multichannel Campaign Management (MCCM).""]","San Francisco, California, United States",1001-5000,"['Analytics', 'Content', 'Customer Service', 'E-Commerce', 'Email Marketing', 'Internet', 'Software', 'Web Development']",Private,www.sitecore.com,"['Apr 26, 2001']","['San Francisco Bay Area, West Coast, Western US']","['Kasper Kjaerbye Larsen, Lars Nielsen, Michael Seifert']",['Active'],NA,['Private Equity'],['For Profit'],NA,NA,3,NA,$1.2B,NA,NA,5,14,NA,33,NA,95,"364,380",1.95%,NA,NA,NA,NA,NA,NA,NA,NA,NA,NA,NA,NA,NA,NA
44,45,n26,NA,"['N26 offers mobile banking in 25 markets.', 'N26 offers mobile banking solutions to customers in the European Union through its subsidiary. It provides international money transfer, investment, overdraft, and cash withdrawal and deposit at stores.\nN26 provides mobile banking services for customers. Its mobile banking services offer online banking that include making and handling of current', 'accounts, fixed accounts, and other banking services, letting customers manage and control their banking details via a smartphone application easily.\nMaximilian Tayenthal and Valentin Stalf founded Papayer in February 2013, which later became N26, with its headquarters in Berlin in Germany.']","Berlin, Berlin, Germany",1001-5000,"['Banking', 'Finance', 'Financial Services', 'FinTech']",Private,n26.com,['Feb 2013'],['European Union (EU)'],"['Maximilian Tayenthal, Valentin Stalf']",['Active'],NA,['Venture - Series Unknown'],['For Profit'],NA,NA,18,10,$819M,NA,6,NA,30,NA,NA,NA,NA,NA,NA,NA,NA,NA,NA,NA,NA,NA,NA,NA,NA,NA,NA,NA,NA
45,46,ripple-labs,NA,"['Ripple provides one frictionless experience to send money globally using the power of blockchain.', 'enterprises to gain access to cross-currency liquidity through a distributed network that allows foreign exchange to be externally sourced from a competitive FX marketplace or an internal FX trading desk. This minimizes FX exposure thereby lowering the volatility and counter-party risk of trades. Ripple Insights features industry updates, insider perspectives, and in-depth market analysis.']","San Francisco, California, United States",501-1000,"['Blockchain', 'Cryptocurrency', 'Financial Services', 'FinTech', 'Internet', 'Payments']",Private,ripple.com,['2012'],"['San Francisco Bay Area, West Coast, Western US']","['Arthur Britto, Chris Larsen, Ryan Fugger']",['Active'],NA,['Secondary Market'],['For Profit'],NA,NA,36,13,$293.8M,1,5,1,24,NA,NA,NA,NA,NA,NA,NA,NA,NA,15,NA,1,NA,NA,NA,NA,NA,NA,NA,NA
46,47,boohoo-com,NA,"['Boohoo is an online store that offers a range of clothing, accessories, and footwear brands.', 'Oasis & Warehouse design, sources, markets and sells clothing, shoes, accessories, and beauty products.\nThe company was founded in 2006 by Carol Kane and Mahmud Kamani in Manchester, Manchester, United Kingdom.']","Manchester, Manchester, United Kingdom",1001-5000,"['Beauty', 'E-Commerce Platforms', 'Fashion', 'Lifestyle', 'Shopping']",Public,www.boohooplc.com/,"['Apr 8, 2006']",NA,"['Carol Kane, Mahmud Kamani']",['Active'],NA,['Post-IPO Equity'],['For Profit'],NA,NA,NA,1,£50M,NA,NA,10,3,NA,NA,NA,NA,NA,NA,NA,NA,NA,NA,NA,NA,NA,NA,NA,NA,NA,NA,NA,NA
47,48,tencent,NA,"['Tencent is an internet service portal offering value-added internet, mobile, telecom, and online advertising services.', 'Tencent is an internet service portal offering value-added internet, mobile, telecom, and online advertising services. Its communications and social platforms Weixin and QQ connect users with each other, with digital content and daily life services in just a few clicks.\nTencent has maintained steady growth under its user-oriented operating', 'strategies. It provides value-added internet, mobile, and telecom services, as well as online advertising under the strategic goal of providing users with ""one-stop online lifestyle services."" Tencent’s Internet platforms in China – QQ (QQ Instant Messenger), WeChat, QQ.com, QQ Games, Qzone, 3g.QQ.com, SoSo, PaiPai, and Tenpay – aim to address the various needs of internet users, including communication, information, entertainment, e-commerce, and others.\nIn September 2013, Tencent\'s market valuation rose to $101 billion, and as of November 21, 2013, QQ had 2 billion active users and WeChat had 650 million monthly active users. The numbers of active users for QQ mail, Qzone, Tencent Weibo, and QQ news were 274 million, 626 million, 220 million, and 150 million, respectively.\nTencent was founded in November of 1998. In April 2000, the IDG and PCCW invested a total of $2.2 million dollars in the company. Tencent was listed on the Hong Kong Stock Exchange (SEHK) on June 16, 2004. Baidu, Alibaba, and Netease are Tencent\'s major competitors.']","Shenzhen, Guangdong, China",10001+,"['Internet', 'Online Games', 'Online Portals', 'Social Media Marketing']",Public,www.tencent.com/en-us/,"['Nov 1, 1998']",['Asia-Pacific (APAC)'],"['Charles Chen, Chenye Xu, Jason Zeng, Pony Ma, Zhidong Zhang']",['Active'],NA,['Post-IPO Debt'],['For Profit'],NA,NA,4,NA,$6.6B,NA,NA,18,72,NA,NA,NA,NA,NA,NA,NA,NA,NA,549,NA,NA,NA,NA,NA,NA,NA,NA,NA,NA
48,49,maude-group,NA,"['maude is redefining the sex essentials industry for modern consumers to make intimacy better—for all people.', 'health.']","Brooklyn, New York, United States",1-10,"['Consumer Goods', 'E-Commerce', 'Health Care', 'Personal Health', 'Wellness']",Private,getmaude.com,['2018'],"['Greater New York Area, East Coast, Northeastern US']",['Eva Goicochea'],['Active'],NA,['Seed'],['For Profit'],NA,NA,22,NA,$4.3M,NA,NA,NA,2,NA,NA,NA,NA,NA,NA,NA,NA,NA,NA,NA,NA,NA,NA,NA,NA,NA,NA,NA,NA
